{
  "schemaVersion": 2,
  "dispatchId": "DISPATCH-20260912-SECOND-REVIEW-09-A1",
  "taskId": "TASK-20260912-second-review-fix-09",
  "idempotencyKey": "second-review-fix-security-review",
  "taskCode": "SECURITY_REVIEW",
  "role": "reviewer",
  "taskType": "security",
  "objective": "独立安全审查本轮差异中的权限、状态 CAS、S3 边界、Archive 输入限制；只写 security.md 与结果文件。",
  "taskRefs": [".ai/tasks/TASK-20260912-second-review-fix-09.md"],
  "stateRef": ".ai/state/20260912-second-review-fix.yaml",
  "artifactRefs": [".ai/docs/20260912-second-review-fix/design.md", ".ai/docs/20260912-second-review-fix/testcases.md"],
  "skillRefs": ["-"],
  "scope": {"include": ["st-core/**", "st-web/**", "st-desktop/**", ".ai/docs/20260912-second-review-fix/security.md", ".ai/runtime/results/DISPATCH-20260912-SECOND-REVIEW-09-A1.json"], "exclude": [".ai/state/**", "docker/**"]},
  "acceptance": ["给出可复现 P0/P1/P2 风险或有边界的通过结论", "核验 owner/space、S3 事务和 CAS 影响行数"],
  "validation": ["git diff 与相关测试报告", "只写审查文档和结果，不改产品代码"],
  "forbidSpawn": true,
  "forbidGitMvn": false,
  "etaMinutes": 30,
  "output": {"artifactRef": ".ai/runtime/results/DISPATCH-20260912-SECOND-REVIEW-09-A1.json"}
}
