{
  "schemaVersion": 2,
  "dispatchId": "DISPATCH-20260923-TSW-ACCEPT-A1",
  "taskId": "TASK-20260923-team-search-watch-accept",
  "idempotencyKey": "20260923-TSW-ACCEPT",
  "role": "reviewer",
  "taskType": "accept",
  "objective": "独立核对 tsw-code-r7 的五条 Goal 完成标准及全部 State 依赖，提出 ACCEPT 结论",
  "stateRef": ".ai/state/20260923-team-search-watch.yaml",
  "taskRefs": [".ai/tasks/TASK-20260923-team-search-watch-accept.md", ".ai/tasks/TASK-20260923-team-search-watch.md", ".ai/docs/20260923-team-search-watch/approval-evidence.md", ".ai/docs/20260923-team-search-watch/testreport.md"],
  "skillRefs": ["-"],
  "scope": {
    "include": [".ai/runtime/results/DISPATCH-20260923-TSW-ACCEPT-A1.json"],
    "exclude": ["st-*/**", "docker/**", ".ai/state/**", ".ai/docs/**"]
  },
  "acceptance": ["五条 Goal completionCriteria 各有真实且当前修订的证据", "全部前置标准已通过；未解决条件不得建议 ACCEPT 通过"],
  "validation": ["只读核查 State、产物及独立结果；不运行构建；结果绑定 tsw-code-r7"],
  "output": {"resultRef": ".ai/runtime/results/DISPATCH-20260923-TSW-ACCEPT-A1.json", "by": "/root/tsw_accept", "validatedRevision": "tsw-code-r7"},
  "forbidSpawn": true
}
