{
  "schemaVersion": 2,
  "dispatchId": "DISPATCH-20260924-DESIGN-CR-02-01",
  "taskId": "TASK-20260924-DESIGN-CR-02",
  "idempotencyKey": "design-20260924-CR-02",
  "role": "executor",
  "taskType": "design",
  "objective": "完成 CR-02 需求和程序设计文档，不执行之后流程",
  "taskRefs": [
    ".ai/tasks/TASK-20260924-DESIGN-CR-02.md"
  ],
  "stateRef": ".ai/docs/20260924-code-review-design/state-snapshot.json",
  "skillRefs": [
    "-"
  ],
  "scope": {
    "exclude": [
      "源码",
      "SQL",
      "配置",
      "测试",
      "Loop State"
    ],
    "include": [
      ".ai/docs/20260924-code-review-design/CR-02/"
    ]
  },
  "acceptance": [
    "基于代码给出完整中文需求及可实施设计",
    "不编写测试用例、不修改程序、不运行构建测试"
  ],
  "validation": [
    "只读核对代码和文档交叉引用"
  ],
  "forbidSpawn": true,
  "output": {
    "resultRef": ".ai/docs/20260924-code-review-design/CR-02/result.json"
  }
}
