{
  "schemaVersion": 2,
  "dispatchId": "DISPATCH-20260923-TSW-EXP-DESIGN-A1",
  "taskId": "TASK-20260923-team-search-watch-exp-design",
  "idempotencyKey": "20260923-TSW-EXP-DESIGN",
  "role": "reviewer",
  "taskType": "exp-review",
  "objective": "独立核对 tsw-design-r3 的 UI 规格在需求与技术设计中的完整覆盖，并提出 EXP_DESIGN 结论",
  "stateRef": ".ai/state/20260923-team-search-watch.yaml",
  "taskRefs": [
    ".ai/tasks/TASK-20260923-team-search-watch-exp-design.md",
    ".ai/docs/20260923-team-search-watch/requirement.md",
    ".ai/docs/20260923-team-search-watch/uispec.md",
    ".ai/docs/20260923-team-search-watch/design.md",
    ".ai/docs/20260923-team-search-watch/architecture-review.md"
  ],
  "skillRefs": ["-"],
  "scope": {
    "include": [
      ".ai/docs/20260923-team-search-watch/exp-review.md",
      ".ai/runtime/results/DISPATCH-20260923-TSW-EXP-DESIGN-A1.json"
    ],
    "exclude": ["st-*/**", "docker/**", ".ai/state/**"]
  },
  "acceptance": ["UI 规格中的入口、状态、键盘、窄屏、权限和竞态逐项有明确覆盖结论", "未解决的影响体验/安全缺口不得建议通过"],
  "validation": ["只读检查当前需求、设计与代码；不运行构建；审查结果绑定 tsw-design-r3"],
  "output": {
    "resultRef": ".ai/runtime/results/DISPATCH-20260923-TSW-EXP-DESIGN-A1.json",
    "by": "/root/tsw_exp_design",
    "validatedRevision": "tsw-design-r3"
  },
  "forbidSpawn": true
}
