{
  "schemaVersion": 2,
  "dispatchId": "DISPATCH-20261022-ratelimit-review-02",
  "taskCode": "multi-node-ratelimit-review-2",
  "taskId": "20261022-multi-node-ratelimit",
  "idempotencyKey": "20261022-multi-node-ratelimit",
  "role": "reviewer",
  "taskType": "review",
  "objective": "独立审查限速多节点化变更并输出 codereview.md。",
  "taskRefs": [
    ".ai/tasks/TASK-20261022-multi-node-ratelimit-01.md",
    ".ai/docs/20261022-multi-node-ratelimit/design.md",
    ".ai/docs/20261022-multi-node-ratelimit/verification.md"
  ],
  "stateRef": ".ai/state/20261022-multi-node-ratelimit.yaml",
  "artifactRefs": [
    ".ai/docs/20261022-multi-node-ratelimit/codereview.md",
    ".ai/runtime/results/DISPATCH-20261022-ratelimit-review-02.json"
  ],
  "skillRefs": [
    "-"
  ],
  "scope": {
    "include": [
      "st-common/src/main/java/com/stcloud/common/ratelimit/",
      "st-core/src/main/java/com/stcloud/core/service/impl/UploadServiceImpl.java",
      "st-core/src/main/java/com/stcloud/core/service/impl/DownloadServiceImpl.java",
      "st-core/src/main/java/com/stcloud/core/service/impl/upload/",
      "st-core/src/main/java/com/stcloud/core/controller/",
      "st-admin/src/main/java/com/stcloud/admin/service/impl/SpeedLimitManageServiceImpl.java",
      "st-sync/src/main/java/com/stcloud/sync/",
      "st-auth/src/main/java/com/stcloud/auth/security/SecurityConfig.java",
      "st-api/src/main/resources/application.yml",
      "docker/"
    ],
    "exclude": [
      "不得修改代码或流程文件",
      "不得执行 mvn",
      "不得执行 git 写操作"
    ]
  },
  "acceptance": [
    "结论明确",
    "发现带 file:line",
    "覆盖并发、故障、安全、测试充分性"
  ],
  "validation": [
    "阅读设计与验证记录",
    "git diff + read 静态审查"
  ],
  "forbidSpawn": true,
  "forbidGitMvn": true,
  "etaMinutes": 8,
  "output": {
    "artifact": ".ai/docs/20261022-multi-node-ratelimit/codereview.md",
    "result": ".ai/runtime/results/DISPATCH-20261022-ratelimit-review-02.json"
  }
}